{
  "schemaVersion": "contract-extraction.v1",
  "extractionVersion": "human-gold.phase0.v1",
  "mode": "dry_run",
  "document": {
    "documentVersionId": "sha256:0FF80EB28A157E748C02676B3C3897EA1FBBB1AD429F12E8AECE0EF062629DDA",
    "filename": "הסכם קבלן-סמל אולם תצוגה הרצליה גרסה לחתימה 1.11.pdf",
    "sha256": "0FF80EB28A157E748C02676B3C3897EA1FBBB1AD429F12E8AECE0EF062629DDA",
    "documentType": "signing_version",
    "executionStatus": "unverified",
    "authorityStatus": "needs_review",
    "executionDate": null,
    "visibleSignatureStatus": "blank",
    "attachmentsStatus": "incomplete",
    "sourceId": null,
    "supersedesDocumentVersionId": null
  },
  "projectBinding": {
    "projectId": null,
    "selectedByUser": false,
    "status": "needs_review",
    "contractSiteRaw": "החושלים 5, הרצליה",
    "contractSiteNormalized": "5 HaHoshlim Street, Herzliya",
    "candidateProjectSite": "15 HaHoshlim Street, Herzliya",
    "automaticBindingAllowed": false,
    "mismatchReasons": [
      "contract_site_differs_from_schedule_specification",
      "no_explicit_user_project_selection"
    ]
  },
  "candidates": [
    {
      "candidateKey": "contract:0ff80eb28a15:clause:6.1_appendix_b.2:role:contractual_completion",
      "documentVersionId": "sha256:0FF80EB28A157E748C02676B3C3897EA1FBBB1AD429F12E8AECE0EF062629DDA",
      "type": "relative_condition",
      "role": "contractual_completion",
      "responsibleParty": "הקבלן",
      "beneficiary": "סמל",
      "action": "Complete and deliver the works",
      "trigger": {
        "kind": "commencement",
        "description": "Reviewed contractual commencement event",
        "eventDate": null
      },
      "fixedDate": null,
      "offset": {
        "value": 100,
        "unit": "working_day",
        "direction": "after",
        "calendarId": null,
        "inclusivity": "unspecified",
        "rollConvention": "unspecified"
      },
      "recurrence": null,
      "projection": "project_schedule",
      "computedDate": null,
      "factStatus": "explicit",
      "reviewStatus": "needs_review",
      "confidence": 1,
      "conflictGroupId": null,
      "operationalEligibility": "blocked",
      "automaticPromotionAllowed": false,
      "storageDisposition": "candidate_for_schedule_contract_conditions",
      "gates": [
        "authority_unverified",
        "project_binding_unreviewed",
        "commencement_event_missing",
        "working_calendar_missing",
        "human_review_required"
      ],
      "sourceEvidence": [
        {
          "pdfPage": 4,
          "clause": "6.1",
          "sourceText": "הקבלן מתחייב כי הוא יבצע את העבודות וישלימן במועד כקבוע בנספח ב'.",
          "documentSha256": "0FF80EB28A157E748C02676B3C3897EA1FBBB1AD429F12E8AECE0EF062629DDA"
        },
        {
          "pdfPage": 14,
          "clause": "Appendix B, item 2",
          "sourceText": "העבודות יושלמו וימסרו לסמל בתוך 100 ימי עבודה ממועד תחילת העבודות.",
          "documentSha256": "0FF80EB28A157E748C02676B3C3897EA1FBBB1AD429F12E8AECE0EF062629DDA"
        }
      ],
      "metadata": {
        "isProjectCompletion": true,
        "literalDayLabel": "ימי עבודה"
      }
    },
    {
      "candidateKey": "contract:0ff80eb28a15:clause:6.7:role:daily_delay_charge_2000",
      "documentVersionId": "sha256:0FF80EB28A157E748C02676B3C3897EA1FBBB1AD429F12E8AECE0EF062629DDA",
      "type": "consequence",
      "role": "daily_delay_charge",
      "responsibleParty": "הקבלן",
      "beneficiary": "סמל",
      "action": "Pay a daily charge for delayed completion",
      "trigger": {
        "kind": "event",
        "description": "Each day after the contractual completion date",
        "eventDate": null
      },
      "fixedDate": null,
      "offset": null,
      "recurrence": null,
      "projection": "project_schedule",
      "computedDate": null,
      "factStatus": "conflicting",
      "reviewStatus": "needs_review",
      "confidence": 1,
      "conflictGroupId": "daily-delay-charge",
      "operationalEligibility": "blocked",
      "automaticPromotionAllowed": false,
      "storageDisposition": "dry_run_only",
      "gates": [
        "material_value_conflict",
        "day_semantics_unresolved",
        "human_review_required"
      ],
      "sourceEvidence": [
        {
          "pdfPage": 5,
          "clause": "6.7",
          "sourceText": "ישלם הקבלן 2,000 שקלים חדשים בגין כל יום איחור ממועד השלמת העבודות.",
          "documentSha256": "0FF80EB28A157E748C02676B3C3897EA1FBBB1AD429F12E8AECE0EF062629DDA"
        }
      ],
      "metadata": {
        "value": 2000,
        "currency": "ILS",
        "originalSourceLabel": "קנס",
        "dayType": "unresolved"
      }
    },
    {
      "candidateKey": "contract:0ff80eb28a15:clause:appendix_b.3:role:daily_delay_charge_3250",
      "documentVersionId": "sha256:0FF80EB28A157E748C02676B3C3897EA1FBBB1AD429F12E8AECE0EF062629DDA",
      "type": "consequence",
      "role": "daily_delay_charge",
      "responsibleParty": "הקבלן",
      "beneficiary": "סמל",
      "action": "Pay a daily charge for delayed completion",
      "trigger": {
        "kind": "event",
        "description": "Each day after the contractual completion date",
        "eventDate": null
      },
      "fixedDate": null,
      "offset": null,
      "recurrence": null,
      "projection": "project_schedule",
      "computedDate": null,
      "factStatus": "conflicting",
      "reviewStatus": "needs_review",
      "confidence": 1,
      "conflictGroupId": "daily-delay-charge",
      "operationalEligibility": "blocked",
      "automaticPromotionAllowed": false,
      "storageDisposition": "dry_run_only",
      "gates": [
        "material_value_conflict",
        "day_semantics_unresolved",
        "human_review_required"
      ],
      "sourceEvidence": [
        {
          "pdfPage": 14,
          "clause": "Appendix B, item 3",
          "sourceText": "הקנס בגין האיחור בהשלמת העבודות: 3,250 ש״ח ליום.",
          "documentSha256": "0FF80EB28A157E748C02676B3C3897EA1FBBB1AD429F12E8AECE0EF062629DDA"
        }
      ],
      "metadata": {
        "value": 3250,
        "currency": "ILS",
        "originalSourceLabel": "קנס",
        "dayType": "unresolved"
      }
    },
    {
      "candidateKey": "contract:0ff80eb28a15:clause:3.14:role:exceptional_event_notice",
      "documentVersionId": "sha256:0FF80EB28A157E748C02676B3C3897EA1FBBB1AD429F12E8AECE0EF062629DDA",
      "type": "notice_rule",
      "role": "exceptional_event_notice",
      "responsibleParty": "הקבלן",
      "beneficiary": "סמל",
      "action": "Provide written notice of an exceptional event",
      "trigger": {
        "kind": "event",
        "description": "Occurrence of an exceptional event",
        "eventDate": null
      },
      "fixedDate": null,
      "offset": {
        "value": 8,
        "unit": "hour",
        "direction": "after",
        "calendarId": null,
        "inclusivity": "unspecified",
        "rollConvention": "none"
      },
      "recurrence": null,
      "projection": "contract_compliance",
      "computedDate": null,
      "factStatus": "explicit",
      "reviewStatus": "needs_review",
      "confidence": 1,
      "conflictGroupId": null,
      "operationalEligibility": "blocked",
      "automaticPromotionAllowed": false,
      "storageDisposition": "dry_run_only",
      "gates": [
        "subday_deadline_not_storable_as_date",
        "compliance_engine_not_approved"
      ],
      "sourceEvidence": [
        {
          "pdfPage": 2,
          "clause": "3.14",
          "sourceText": "מיד לאחר התרחשותם, ובכל מקרה לא יאוחר מ-8 שעות ממועד קרות אירוע כאמור.",
          "documentSha256": "0FF80EB28A157E748C02676B3C3897EA1FBBB1AD429F12E8AECE0EF062629DDA"
        }
      ],
      "metadata": {}
    },
    {
      "candidateKey": "contract:0ff80eb28a15:clause:3.17:role:weekly_waste_removal",
      "documentVersionId": "sha256:0FF80EB28A157E748C02676B3C3897EA1FBBB1AD429F12E8AECE0EF062629DDA",
      "type": "recurring_rule",
      "role": "weekly_waste_removal",
      "responsibleParty": "הקבלן",
      "beneficiary": "סמל",
      "action": "Remove accumulated waste and construction debris",
      "trigger": {
        "kind": "event",
        "description": "Each project week during performance",
        "eventDate": null
      },
      "fixedDate": null,
      "offset": null,
      "recurrence": {
        "frequency": "weekly",
        "window": "at_least_once_per_week",
        "occurrencePolicy": "each_occurrence"
      },
      "projection": "contract_compliance",
      "computedDate": null,
      "factStatus": "explicit",
      "reviewStatus": "needs_review",
      "confidence": 1,
      "conflictGroupId": null,
      "operationalEligibility": "blocked",
      "automaticPromotionAllowed": false,
      "storageDisposition": "dry_run_only",
      "gates": [
        "recurring_occurrence_history_not_supported",
        "compliance_engine_not_approved"
      ],
      "sourceEvidence": [
        {
          "pdfPage": 3,
          "clause": "3.17",
          "sourceText": "יקפיד לסלק, מדי שבוע, לכל הפחות, את כל מצבורי האשפה ופסולת הבנין.",
          "documentSha256": "0FF80EB28A157E748C02676B3C3897EA1FBBB1AD429F12E8AECE0EF062629DDA"
        }
      ],
      "metadata": {}
    },
    {
      "candidateKey": "contract:0ff80eb28a15:clause:7.7_7.8:role:monthly_payment_chain",
      "documentVersionId": "sha256:0FF80EB28A157E748C02676B3C3897EA1FBBB1AD429F12E8AECE0EF062629DDA",
      "type": "recurring_rule",
      "role": "monthly_payment_chain",
      "responsibleParty": "סמל",
      "beneficiary": "הקבלן",
      "action": "Review monthly account and pay the approved amount",
      "trigger": {
        "kind": "month_end",
        "description": "End of the month in which the approved interim account was submitted",
        "eventDate": null
      },
      "fixedDate": null,
      "offset": {
        "value": 25,
        "unit": "calendar_day",